Where in your CV this entry belongs,Main title of the entry,Location the entry occured,Primary institution affiliation for entry,Start date of entry (year),"End year of entry. Set to ""current"" if entry is still ongoing.","Each description column is a separate bullet point for the entry. If you need more description bullet points simply add a new column with title ""description_{4,5,..}""",,,A filter variable that is used to decide if entry is in the smaller resume. 
section,title,loc,institution,start,end,description_1,description_2,description_3,in_resume
education,"M.Sc., Numerical Methods in Engineering",Universidade Federal do Paraná (UFPR),"Curitiba, PR",2021,2023,Focused on Generalized Estimating Equation for expand multiple response models,,,TRUE
education,"B.Sc., Statistics (minor C.S.)",Universidade Federal do Paraná (UFPR),"Curitiba, PR",2016,2020,Thesis: Inverse Normal Dispersion models based on Deviance residuals,,,TRUE
education,"B.Sc., Agronomic Engineering",ESALQ-USP,"São Paulo, SP",2014,2016,Where I met Statistics and Programming for the first time,,,TRUE
industry_positions,Senior Data Scientist,Kzas,"São Paulo, SP",2021,Present,Automatic Valuation Models for Brazilian Banks as an service.,,,TRUE
industry_positions,Data Scientist,MadeiraMadeira,"Curitiba, PR",2019,2021,Marketing Mix Modeling and Investment Optimizations for retention and acquisition marketing campaigns,Natural Language and Propensity models to serve the Marketing Intelligence area.,,TRUE
industry_positions,Junior Data Science,Isket,"Curitiba, PR",2018,2019,Data quality pipelines from the Web Scraping process for the real estate market,Real Estate Scoring and Feasibility Analysis of the Real Estate Market Return for Developers,,TRUE
industry_positions,Data Analyst / Adviser,Department of Health (Secretaria da Saúde do Paraná – SESA),"Curitiba, PR",2017,2019,Models of Deduplication of Records based on speech and written likelihood.  ,Statistical models to assess the effectiveness of the dengue vaccine in the State of Paraná.,,TRUE
